{
  "schemaVersion": 1,
  "id": "AP-20260811-002",
  "status": "draft",
  "workflowId": "A-018",
  "workflowVersion": 1,
  "actionClass": "production_change",
  "requestedBy": "Company task",
  "approvedBy": null,
  "approvedAt": null,
  "approvalEvidenceRef": null,
  "decisionRef": "D-014 and D-015 remain unresolved; preview-only scope",
  "issuedAt": "2026-08-11T11:52:51Z",
  "validUntil": "2026-08-12T11:52:51Z",
  "environment": "preview",
  "targets": [
    {
      "system": "Game Development release workflow",
      "account": "Unassigned release owner",
      "destination": "Isolated non-production preview for mythicalvoid.com"
    }
  ],
  "allowedOperations": [
    "construct preview from exact patch",
    "run RM-001 preview checks"
  ],
  "prohibitedOperations": [
    "apply patch to the shared working tree",
    "stage or commit repository changes",
    "push a branch",
    "deploy to production",
    "change DNS or accounts",
    "publish or send externally",
    "accept terms or spend funds"
  ],
  "maxActions": 2,
  "spend": {
    "currency": "EUR",
    "maximumMinorUnits": 0
  },
  "dataZones": ["Z0", "Z1"],
  "artifact": {
    "path": "docs/company/operations/release-manifests/artifacts/RM-001-company-only.patch",
    "sha256": "237902bfceb9117a268444fd9a1ad57d62a5aa997ebf3b243c63c03f5d838c62"
  },
  "idempotencyKey": "rm-001-preview-237902bfceb9117a",
  "dryRunEvidence": "A-018 verifies the patch digest, clean application to base commit 1d5c14736ded3480c36f92167353f23a78c4bbef, five isolated-result digests, and exclusion of the Wanderer-77 storefront hunks.",
  "rollbackPlan": "Discard the isolated preview. No shared-tree, repository-index, branch, remote, production, account, or customer state may change under this draft.",
  "auditDestination": "docs/company/operations/release-manifests/DISCOVERY_SAFETY_2026-08-11.json"
}
